category1,category2,category3,category4,category5,rowTitle,row1Title1,row3Value1,route,row1Value1,row2Title1,row2Value1,row2Title2,row2Value2,urlHero,urlTileBackGroundImage,urlIcon,utcLastUpdated,richBodyText,,,,
Gameing Stuff,Headsets,Sennheiser,SENNHEISER HD 4.50 Bluetooth Wireless Headphones,,SENNHEISER HD 4.50 Bluetooth Wireless Headphones,SENNHEISER HD 4.50 Bluetooth Wireless Headphones,"High definition, top quality",,,,,,,https://m.media-amazon.com/images/I/51v9N5-cPvL._AC_SL1000_.jpg,https://m.media-amazon.com/images/I/51v9N5-cPvL._AC_SL1001_.jpg,https://m.media-amazon.com/images/I/51v9N5-cPvL._AC_SL1002_.jpg,https://m.media-amazon.com/images/I/51v9N5-cPvL._AC_SL1003_.jpg,,,,,
Gameing Stuff,Headsets,Sennheiser,HD 2.30,,HD 2.30,HD 2.30,Ultra lightweight on ear design ensures exceptional wearing comfortConnectivity Technology: Wired,,,,,,,https://m.media-amazon.com/images/I/71A6qISEsPL._AC_SL1500_.jpg,https://m.media-amazon.com/images/I/71A6qISEsPL._AC_SL1501_.jpg,https://m.media-amazon.com/images/I/71A6qISEsPL._AC_SL1502_.jpg,https://m.media-amazon.com/images/I/71A6qISEsPL._AC_SL1503_.jpg,,,,,
Gameing Stuff,Headsets,Sennheiser,Sennheiser HD 350BT Wireless foldable Headphones,,Sennheiser HD 350BT Wireless foldable Headphones,Sennheiser HD 350BT Wireless foldable Headphones,"Bluetooth 5.0 technology for effortless, reliable connectivity including AAC and AptX Low Latency codec support",,,,,,,https://m.media-amazon.com/images/I/61mmEqLILQS._AC_SL1500_.jpg,https://m.media-amazon.com/images/I/61mmEqLILQS._AC_SL1501_.jpg,https://m.media-amazon.com/images/I/61mmEqLILQS._AC_SL1502_.jpg,https://m.media-amazon.com/images/I/61mmEqLILQS._AC_SL1503_.jpg,,,,,
Gameing Stuff,Headsets,Sony,Sony MDRZX110NC Noise Cancelling Headphones,,Sony MDRZX110NC Noise Cancelling Headphones,Sony MDRZX110NC Noise Cancelling Headphones,"Over ear, Noise isolating Headphones. Connectivity Technology: Wired",,,,,,,https://m.media-amazon.com/images/I/61EMRwGnzJL._AC_SL1320_.jpg,https://m.media-amazon.com/images/I/61EMRwGnzJL._AC_SL1321_.jpg,https://m.media-amazon.com/images/I/61EMRwGnzJL._AC_SL1322_.jpg,https://m.media-amazon.com/images/I/61EMRwGnzJL._AC_SL1323_.jpg,,,,,
Gameing Stuff,Headsets,Sony,Sony WH-1000XM4 Black - Wireless Headphones,,Sony WH-1000XM4 Black - Wireless Headphones,Sony WH-1000XM4 Black - Wireless Headphones,Industry-leading noise canceling with Dual Noise Sensor technology,,,,,,,https://m.media-amazon.com/images/I/71o8Q5XJS5L._AC_SL1500_.jpg,https://m.media-amazon.com/images/I/71o8Q5XJS5L._AC_SL1501_.jpg,https://m.media-amazon.com/images/I/71o8Q5XJS5L._AC_SL1502_.jpg,https://m.media-amazon.com/images/I/71o8Q5XJS5L._AC_SL1503_.jpg,,,,,
Gameing Stuff,Headsets,Sony,Sony Wireless Headphones WH-CH510,,Sony Wireless Headphones WH-CH510,Sony Wireless Headphones WH-CH510,Bluetooth wireless technology for unrestricted movement,,,,,,,https://images-na.ssl-images-amazon.com/images/I/811u6QEwQxL._SL1500_.jpg,https://images-na.ssl-images-amazon.com/images/I/811u6QEwQxL._SL1501_.jpg,https://images-na.ssl-images-amazon.com/images/I/811u6QEwQxL._SL1502_.jpg,https://images-na.ssl-images-amazon.com/images/I/811u6QEwQxL._SL1503_.jpg,,,,,
Gameing Stuff,Headsets,Bang & Olufsen,BEOPLAY HX Comfortable ANC headphones,,BEOPLAY HX Comfortable ANC headphones,BEOPLAY HX Comfortable ANC headphones,Offering a powerful and authentic sound experience with Adaptive Active Noise Cancellation,,,,,,,https://m.media-amazon.com/images/I/719DuO-gysS._AC_SL1500_.jpg,https://m.media-amazon.com/images/I/719DuO-gysS._AC_SL1501_.jpg,https://m.media-amazon.com/images/I/719DuO-gysS._AC_SL1502_.jpg,https://m.media-amazon.com/images/I/719DuO-gysS._AC_SL1503_.jpg,,,,,
Gameing Stuff,Headsets,Bang & Olufsen,BEOPLAY H95 Adaptive ANC headphones,,BEOPLAY H95 Adaptive ANC headphones,BEOPLAY H95 Adaptive ANC headphones,"elebrating 95 years of heritage in sound, design and craft excellence.",,,,,,,https://m.media-amazon.com/images/I/812oJbO5aTS._AC_SL1500_.jpg,https://m.media-amazon.com/images/I/812oJbO5aTS._AC_SL1501_.jpg,https://m.media-amazon.com/images/I/812oJbO5aTS._AC_SL1502_.jpg,https://m.media-amazon.com/images/I/812oJbO5aTS._AC_SL1503_.jpg,,,,,
Gameing Stuff,Headsets,Bang & Olufsen,HEADPHONES BANG & OLUFSEN BEOPLAY H9I,,HEADPHONES BANG & OLUFSEN BEOPLAY H9I,HEADPHONES BANG & OLUFSEN BEOPLAY H9I,"EASY LISTENING: Adjust the volume, change tracks and take calls with on-device touch controls.�",,,,,,,https://images-na.ssl-images-amazon.com/images/I/61HahnTbx7L._AC_SL1201_.jpg,https://images-na.ssl-images-amazon.com/images/I/61HahnTbx7L._AC_SL1202_.jpg,https://images-na.ssl-images-amazon.com/images/I/61HahnTbx7L._AC_SL1203_.jpg,https://images-na.ssl-images-amazon.com/images/I/61HahnTbx7L._AC_SL1204_.jpg,,,,,
Gameing Stuff,Headsets,Logitech,Logitech G733 Lightspeed Wireless Gaming Headset with Suspension Headband,,Logitech G733 Lightspeed Wireless Gaming Headset with Suspension Headband,Logitech G733 Lightspeed Wireless Gaming Headset with Suspension Headband,Total freedom with up to 20 meter wireless range and Lightspeed wireless audio transmission.,,,,,,,https://m.media-amazon.com/images/I/716gbwgdY-L._AC_SL1500_.jpg,https://m.media-amazon.com/images/I/716gbwgdY-L._AC_SL1501_.jpg,https://m.media-amazon.com/images/I/716gbwgdY-L._AC_SL1502_.jpg,https://m.media-amazon.com/images/I/716gbwgdY-L._AC_SL1503_.jpg,,,,,
Gameing Stuff,Headsets,Logitech,G635 7.1 LIGHTSYNC GAMING HEADSET,,G635 7.1 LIGHTSYNC GAMING HEADSET,G635 7.1 LIGHTSYNC GAMING HEADSET,Premium wired Gaming headphones enhanced with the latest advanced technology from Logitech G,,,,,,,https://m.media-amazon.com/images/I/61jFJCRTPkL._AC_SL1000_.jpg,https://m.media-amazon.com/images/I/61jFJCRTPkL._AC_SL1001_.jpg,https://m.media-amazon.com/images/I/61jFJCRTPkL._AC_SL1002_.jpg,https://m.media-amazon.com/images/I/61jFJCRTPkL._AC_SL1003_.jpg,,,,,
Gameing Stuff,Headsets,Logitech,Logitech G935 Wireless 7.1 Surround Sound LIGHTSYNC Gaming Headset,,Logitech G935 Wireless 7.1 Surround Sound LIGHTSYNC Gaming Headset,Logitech G935 Wireless 7.1 Surround Sound LIGHTSYNC Gaming Headset,The most advanced wireless gaming headset yet from Logitech G. 2.4 GHz wireless,,,,,,,https://m.media-amazon.com/images/I/71FkbQzfOYL._AC_SL1500_.jpg,https://m.media-amazon.com/images/I/71FkbQzfOYL._AC_SL1501_.jpg,https://m.media-amazon.com/images/I/71FkbQzfOYL._AC_SL1502_.jpg,https://m.media-amazon.com/images/I/71FkbQzfOYL._AC_SL1503_.jpg,,,,,
Gameing Stuff,Console,Xbox,Xbox 360,,Xbox 360,Xbox 360,Sleek New Design 4GB internal memory.Built-in Wi-Fi,,,,,,,https://m.media-amazon.com/images/I/61oFqsoj9nL._SL1000_.jpg,https://m.media-amazon.com/images/I/61oFqsoj9nL._SL1001_.jpg,https://m.media-amazon.com/images/I/61oFqsoj9nL._SL1002_.jpg,https://m.media-amazon.com/images/I/61oFqsoj9nL._SL1003_.jpg,,,,,
Gameing Stuff,Console,Xbox,Xbox Series x,,Xbox Series x,Xbox Series x,"Introducing Xbox Series X, the fastest, most powerful Xbox ever",,,,,,,https://m.media-amazon.com/images/I/41OH7dLwaJL._SL1280_.jpg,https://m.media-amazon.com/images/I/41OH7dLwaJL._SL1281_.jpg,https://m.media-amazon.com/images/I/41OH7dLwaJL._SL1282_.jpg,https://m.media-amazon.com/images/I/41OH7dLwaJL._SL1283_.jpg,,,,,
Gameing Stuff,Console,Xbox,Xbox,,Xbox,Xbox,"This pre-owned product has been professionally inspected, tested and cleaned by Amazon-qualified suppliers.",,,,,,,https://upload.wikimedia.org/wikipedia/commons/4/43/Xbox-console.jpg,https://upload.wikimedia.org/wikipedia/commons/4/43/Xbox-console.jpg,https://upload.wikimedia.org/wikipedia/commons/4/43/Xbox-console.jpg,https://upload.wikimedia.org/wikipedia/commons/4/43/Xbox-console.jpg,https://upload.wikimedia.org/wikipedia/commons/4/43/Xbox-console.jpg,https://upload.wikimedia.org/wikipedia/commons/4/43/Xbox-console.jpg,https://upload.wikimedia.org/wikipedia/commons/4/43/Xbox-console.jpg,,
Gameing Stuff,Console,Playstation,Playstation 5,,Playstation 5,Playstation 5,"Lightning Speed - Harness the power of a custom CPU, GPU, and SSD with Integrated I/O that rewrite the rules of what a PlayStation console can do.",,,,,,,https://m.media-amazon.com/images/I/619BkvKW35L._SL1500_.jpg,https://m.media-amazon.com/images/I/619BkvKW35L._SL1501_.jpg,https://m.media-amazon.com/images/I/619BkvKW35L._SL1502_.jpg,https://m.media-amazon.com/images/I/619BkvKW35L._SL1503_.jpg,,,,,
Gameing Stuff,Console,Playstation,Playstation 4,,Playstation 4,Playstation 4,"Includes a new slim 1TB PlayStation 4 system, a matching DualShock 4 Wireless Controller.",,,,,,,https://m.media-amazon.com/images/I/61OL2zIliML._SL1500_.jpg,https://m.media-amazon.com/images/I/61OL2zIliML._SL1501_.jpg,https://m.media-amazon.com/images/I/61OL2zIliML._SL1502_.jpg,https://m.media-amazon.com/images/I/61OL2zIliML._SL1503_.jpg,,,,,
Gameing Stuff,Console,Playstation,Playstation 3,,Playstation 3,Playstation 3,IBM Cell processor and a co-developed NVIDIA graphics processor,,,,,,,https://images-na.ssl-images-amazon.com/images/I/51FjbFhrcJS._SL1499_.jpg,https://images-na.ssl-images-amazon.com/images/I/51FjbFhrcJS._SL1500_.jpg,https://images-na.ssl-images-amazon.com/images/I/51FjbFhrcJS._SL1501_.jpg,https://images-na.ssl-images-amazon.com/images/I/51FjbFhrcJS._SL1502_.jpg,,,,,
Gameing Stuff,Console,Nintendo,Nintendo Switch,,Nintendo Switch,Nintendo Switch,"3 Play Styles: TV Mode, Tabletop Mode, Handheld Mode",,,,,,,https://m.media-amazon.com/images/I/61-PblYntsL._AC_SL1500_.jpg,https://m.media-amazon.com/images/I/61-PblYntsL._AC_SL1501_.jpg,https://m.media-amazon.com/images/I/61-PblYntsL._AC_SL1502_.jpg,https://m.media-amazon.com/images/I/61-PblYntsL._AC_SL1503_.jpg,,,,,
Gameing Stuff,Console,Nintendo,Nintendo Wii,,Nintendo Wii,Nintendo Wii,"With motion-control technology, the gamer can truly interact with the game on a personal level, rather than participating as a passive player",,,,,,,https://m.media-amazon.com/images/I/61PGNwIiUeL._SL1500_.jpg,https://m.media-amazon.com/images/I/61PGNwIiUeL._SL1501_.jpg,https://m.media-amazon.com/images/I/61PGNwIiUeL._SL1502_.jpg,https://m.media-amazon.com/images/I/61PGNwIiUeL._SL1503_.jpg,,,,,
Gameing Stuff,Console,Nintendo,Nintendo Game Cube,,Nintendo Game Cube,Nintendo Game Cube,The 485MHz processor makes loading & starting the games faster than ever - no more long load times,,,,,,,https://upload.wikimedia.org/wikipedia/commons/thumb/d/d1/GameCube-Set.jpg/1200px-GameCube-Set.jpg,https://upload.wikimedia.org/wikipedia/commons/thumb/d/d1/GameCube-Set.jpg/1200px-GameCube-Set.jpg,https://upload.wikimedia.org/wikipedia/commons/thumb/d/d1/GameCube-Set.jpg/1200px-GameCube-Set.jpg,https://upload.wikimedia.org/wikipedia/commons/thumb/d/d1/GameCube-Set.jpg/1200px-GameCube-Set.jpg,https://upload.wikimedia.org/wikipedia/commons/thumb/d/d1/GameCube-Set.jpg/1200px-GameCube-Set.jpg,https://upload.wikimedia.org/wikipedia/commons/thumb/d/d1/GameCube-Set.jpg/1200px-GameCube-Set.jpg,https://upload.wikimedia.org/wikipedia/commons/thumb/d/d1/GameCube-Set.jpg/1200px-GameCube-Set.jpg,https://upload.wikimedia.org/wikipedia/commons/thumb/d/d1/GameCube-Set.jpg/1200px-GameCube-Set.jpg,https://upload.wikimedia.org/wikipedia/commons/thumb/d/d1/GameCube-Set.jpg/1200px-GameCube-Set.jpg
Gameing Stuff,Controller,Hori,Nintendo Switch Wireless HORIPAD ,,Nintendo Switch Wireless HORIPAD ,Nintendo Switch Wireless HORIPAD ,Bluetooth wireless Controller with 32-foot range,,,,,,,https://m.media-amazon.com/images/I/61K+097NOyL._SL1500_.jpg,https://m.media-amazon.com/images/I/61K+097NOyL._SL1501_.jpg,https://m.media-amazon.com/images/I/61K+097NOyL._SL1502_.jpg,https://m.media-amazon.com/images/I/61K+097NOyL._SL1503_.jpg,,,,,
Gameing Stuff,Controller,Hori,HORI Nintendo Switch HORIPAD Wired Controller Officially ,,HORI Nintendo Switch HORIPAD Wired Controller Officially ,HORI Nintendo Switch HORIPAD Wired Controller Officially ,Officially licensed wired controller for Nintendo Switch,,,,,,,https://m.media-amazon.com/images/I/41SFL72KcCL._AC_.jpg,https://m.media-amazon.com/images/I/41SFL72KcCL._AC_.jpg,https://m.media-amazon.com/images/I/41SFL72KcCL._AC_.jpg,https://m.media-amazon.com/images/I/41SFL72KcCL._AC_.jpg,https://m.media-amazon.com/images/I/41SFL72KcCL._AC_.jpg,https://m.media-amazon.com/images/I/41SFL72KcCL._AC_.jpg,https://m.media-amazon.com/images/I/41SFL72KcCL._AC_.jpg,https://m.media-amazon.com/images/I/41SFL72KcCL._AC_.jpg,https://m.media-amazon.com/images/I/41SFL72KcCL._AC_.jpg
Gameing Stuff,Controller,Hori,Hori Fighting Commander OCTA - Xbox,,Hori Fighting Commander OCTA - Xbox,Hori Fighting Commander OCTA - Xbox,Wired Controller optimized for fighting games,,,,,,,https://m.media-amazon.com/images/I/71wzMs-nLGL._SL1500_.jpg,https://m.media-amazon.com/images/I/71wzMs-nLGL._SL1501_.jpg,https://m.media-amazon.com/images/I/71wzMs-nLGL._SL1502_.jpg,https://m.media-amazon.com/images/I/71wzMs-nLGL._SL1503_.jpg,,,,,
Gameing Stuff,Controller,Nyko,Power A - Xbox One - Fusion Pro Wired,,Power A - Xbox One - Fusion Pro Wired,Power A - Xbox One - Fusion Pro Wired,Mappable Pro Pack - Map buttons to the rear paddles on-the-fly without letting go of the thumb sticks,,,,,,,https://m.media-amazon.com/images/I/71GM8sD-EjL._SL1500_.jpg,https://m.media-amazon.com/images/I/71GM8sD-EjL._SL1501_.jpg,https://m.media-amazon.com/images/I/71GM8sD-EjL._SL1502_.jpg,https://m.media-amazon.com/images/I/71GM8sD-EjL._SL1503_.jpg,,,,,
Gameing Stuff,Controller,Nyko,Power A Enhanced Wireless Controller for Nintendo Switch - Blue,,Power A Enhanced Wireless Controller for Nintendo Switch - Blue,Power A Enhanced Wireless Controller for Nintendo Switch - Blue,Wireless freedom using Bluetooth 5.0,,,,,,,https://m.media-amazon.com/images/I/81eHZp6ki7L._SL1500_.jpg,https://m.media-amazon.com/images/I/81eHZp6ki7L._SL1501_.jpg,https://m.media-amazon.com/images/I/81eHZp6ki7L._SL1502_.jpg,https://m.media-amazon.com/images/I/81eHZp6ki7L._SL1503_.jpg,,,,,
Gameing Stuff,Controller,Nyko,"PowerA Enhanced Wired Controller for Xbox One, Officially Licensed - Spectra",,"PowerA Enhanced Wired Controller for Xbox One, Officially Licensed - Spectra","PowerA Enhanced Wired Controller for Xbox One, Officially Licensed - Spectra",Illuminate your gameplay with this officially licensed Spectra Enhanced Wired Controller for Xbox One from PowerA.,,,,,,,https://m.media-amazon.com/images/I/81GjjlzwuEL._SL1500_.jpg,https://m.media-amazon.com/images/I/81GjjlzwuEL._SL1501_.jpg,https://m.media-amazon.com/images/I/81GjjlzwuEL._SL1502_.jpg,https://m.media-amazon.com/images/I/81GjjlzwuEL._SL1503_.jpg,,,,,
Gameing Stuff,Controller,PowerA,Nyko Switch Wireless Core Controller,,Nyko Switch Wireless Core Controller,Nyko Switch Wireless Core Controller,Full sized wireless controller with programmable turbo functionality,,,,,,,https://m.media-amazon.com/images/I/81ylNgodUFL._SL1500_.jpg,https://m.media-amazon.com/images/I/81ylNgodUFL._SL1501_.jpg,https://m.media-amazon.com/images/I/81ylNgodUFL._SL1502_.jpg,https://m.media-amazon.com/images/I/81ylNgodUFL._SL1503_.jpg,,,,,
Gameing Stuff,Controller,PowerA,Nyko Retro Core Controller for Nintendo Switch,,Nyko Retro Core Controller for Nintendo Switch,Nyko Retro Core Controller for Nintendo Switch,Full sized retro style wired Controller to bring the nostalgia back to gaming,,,,,,,https://m.media-amazon.com/images/I/71+N8-iA5dL._SL1500_.jpg,https://m.media-amazon.com/images/I/71+N8-iA5dL._SL1501_.jpg,https://m.media-amazon.com/images/I/71+N8-iA5dL._SL1502_.jpg,https://m.media-amazon.com/images/I/71+N8-iA5dL._SL1503_.jpg,,,,,
Gameing Stuff,Controller,PowerA,B&H Nyko PlayPad Pro Controller,,Nyko PlayPad Pro Controller,Nyko PlayPad Pro Controller,Easily control your favorite Amazon Fire TV game with precision,,,,,,,https://images-na.ssl-images-amazon.com/images/I/71iTkX-SZjL._AC_SL1500_.jpg,https://images-na.ssl-images-amazon.com/images/I/71iTkX-SZjL._AC_SL1501_.jpg,https://images-na.ssl-images-amazon.com/images/I/71iTkX-SZjL._AC_SL1502_.jpg,https://images-na.ssl-images-amazon.com/images/I/71iTkX-SZjL._AC_SL1503_.jpg,,,,,
